<?xml version="1.0" encoding="UTF-8"?>
<ciutat xmlns:xsi="http://www.w3.org/2001/XMLSchema-instance"
    xsi:noNamespaceSchemaLocation="ciudad.xsd">
    <nom>Athens</nom>
    <state>GA</state>
    <description> Home of the University of Georgia</description>
    <population>100000</population>
    <location>Located about 60 miles Northeast of Atlanta</location>
    <latitude>33 57' 39" N</latitude>
    <longitude>83 22' 42" W</longitude>
</ciutat>